video_id,video_title,thumbnail_path,transcript,publish_date
3rCZBfhbDjU,Extremisten in Deutschland: Wann Ausweisungen und Abschiebungen möglich sind | DW Nachrichten,data/de_DW\Extremisten in Deutschland Wann Ausweisungen und Abschiebungen möglich sind  DW Nachrichten.jpg,"nach den Terrorangriffen der Hamas auf
Israel vor mehr als zwei Wochen kam es
wiederholt zu proalästinensischen
Demonstrationen in Deutschland dass die
Taten der bilitant islamistischen Hamas
in Berlin und auch anderen Orts von
einigen bejubelt wurden sorgt für
Entsetzen und heizt in Deutschland eine
neue Debatte um Abschiebungen an die
Bundesregierung und die Opposition
fordern daher einen knallharten Kurs
gegen Sympathisanten der terrormiliz
Hamas und eine schnelle Ausweisung von
Unterstützern und UnterstützerInnen aber
geht das so einfach darüber spreche ich
jetzt mit Anus farahat sie ist
Professorin für öffentliches Recht
migrationsrecht und Menschenrechte an
der friedrich- Alexander Universität
Erlangen Nürnberg herzlich willkommen
Frau
farrat ja vielen Dank guten Tag unter
anderem die Innenministerin fordert
Unterstützer der Terrororganisation
Hamas aus Deutschland auszuweisen und
alle aufenthaltsrechtlichen
Möglichkeiten zu nutzen also
letztendlich abzuschieben
geht das so einfach ja grundsätzlich
geht das schon man muss erstmal
unterscheiden zwischen einer Ausweisung
und einer Abschiebung die Ausweisung
bedeutet erstmal nur dass eine Person
die hier ein aufenilsrecht hat dieses
aufenthilsrecht verliert und die
Abschiebung ist dann die Umsetzung
sozusagen also wenn die Person nicht
freiwillig ausreist was sie eigentlich
müsste wenn sie keinen aufeniltsrecht
hat dann wird sie abgeschoben und das
ist dann sozusagen die der Vollzug
dieser Ausweisung und im
ausweisungsrecht der Bundesrepublik gibt
es auch jetzt schon die Möglichkeit
Unterstützerinnen und Unterstützer von
Terrororganisationen
auszuweisen man muss dazu sagen bei
einer Ausweisung muss immer eine
abwäungsentscheidung getroffen werden
zwischen einerseits den privaten
Interessen daran hier zu bleiben also
den Interessen der Ausländerinnen und
Ausländer und auf der anderen Seite den
öffentlichen Interessen an der
Ausweisung und bei der Unterstützung
einer Terrororganisation geht man eben
von einem besonders schweren
ausweisungsinteresse aus so dass im
Prinzip diese Möglichkeit ähm auch schon
heute besteht und das ist dann eben eine
Frage der Interpretation wann diese
Unterstützung
vorliegt ja das wäre auch meine nächste
Frage wie definiert sich denn ein
hamasunterstützer Unterstützerin zählen
da z.B schon Menschen dazu die in Berlin
nach den Terroranschlägen vom 7 Oktober
Süßigkeiten auf der Straße verteilt
haben gibt's da überhaupt eine
juristische
Definition ja es gibt durchaus eine
juristische Definition und grundsätzlich
ist Unterstützung hier in diesem Kontext
auch nicht sehr eng gefasst aber es muss
eben schon eine explizite Unterstützung
sein die auch erkennen lässt dass auch
die terroristischen Ziele der Hamas
unterstützt werden und
da ist jetzt sicherlich nicht jede
Sympathiebekundung oder jede
propalästina Äußerung lässt sich da
sicherlich nicht drunter erfassen und
auch nicht eine einfache
demonstrationsteilnahme es muss also
schon
wirklich zum Ausdruck kommen dass eine
Person die terroristischen und
gewalttätigen Ziele der Hamas eben
wirklich auch unterstützt und
das muss natürlich dann im Einzelfall
entschieden werden aber ich denke eine
einfache demonstrationsteilnahme wenn
die Demonstration eben nicht klar auf
die den die Unterstützung solcher
terroristischer Gewalt ausgerichtet ist
würde erstmal nicht ausreichen
okay aber wenn eine aktive Unterstützung
in Form z.B von
Geldüberweisungen stattfindet oder
Straftaten vorliegen dann könnte eine
Person abgeschoben
werden ja Straftaten ist noch mal eine
andere Frage man muss hier auch
unterscheiden die Unterstützung einer
Terrororganisation im
ausweisungsrechtlichen Sinne ist weiter
als im strafrechtlichen Sinne also bis
man strafrechtlich belangt werden kann
für die Unterstützung einer
Terrororganisation muss man mehr tun
aber für die Ausweisung würde
beispielsweise ihr Beispiel mit dem
geldüberweisen durchaus ausreichen
geldüberweisen oder auch Personen
schützen vor Straftaten zu Hause bei
sich aufnehmen solche Dinge also das das
würde alles ausreichen und auch wenn man
sich sozusagen explizit ähm auch positiv
auf diesen
Terrorakt der Hamas bezieht äh oder auch
auf andere Terrorakte der Hamas auch
dann würde das ausreichend für diesen
Straftatbestand äh Quatsch für diesen
ausweisungstatbestand jetzt habe ich
mich selber
vertan sie haben vorhin schon den
Unterschied von Ausweisung und
Abschiebung aufgegriffen wieso kommt es
denn trotz einer Ausweisung also dem
Entzug der
Aufenthaltserlaubnis oft dann nicht zu
einer Abschiebung
letztenendes also das hat verschiedene
Gründe ein Grund sind mitunter auch
verwaltungsverzögerung also einfach eine
nicht Umsetzung dann diese dieser
abschiebungs dieser absie bung die
eigentlich möglich wäre aber ein
häufigerer Grund ist dass äh
Menschenrechte verhindern dass Menschen
in bestimmte Länder abgeschoben werden
können z.B weil in diesen Ländern
unmittelbare Gewalt droht unmittelbare
Verletzung des Lebens oder der
körperlichen Unversehrtheit für die
Menschen droht die dorthineschoben
werden das ist beispielsweise in ein
Land wie Afghanistan so aber man könnte
durchaus auch ähm argumentieren dass so
wie die Situation eben im Moment z.B im
Gazastreifen ist eben auch da eine
Abschiebung gar nicht so einfach möglich
ist weil eben jeder der dorthin
zurückgebracht wird oder dorthin
gebracht wird letztlich Gefahr läuft in
unwürdigen Umständen zu leben zu hungern
keine Versorgung zu haben Gewalt
ausgesetzt zu sein das sind also
menschenrechtliche Gründe die die
abscheiebung verhindern in anderen
Fällen gerade auch bei aktiven
Konflikten kann es auch mal sein dass
auch technisch die abschie gerade gar
nicht möglich ist weil z.B gar keine
Flüge in ein bestimmtes Land dann eben
möglich sind und damit eben auch keine
Abschiebung letztlich möglich ist hat
denn dann der deutsche Staat überhaupt
eine Handhabe gegen Menschen die
nachgewiesen die has unterstützen aber
nicht abgeschoben werden können weil sie
beispielsweise eben nicht in das Land
ausreisen können oder z.B auch hier
Familie und Kinder
haben na ja der deutsche Staat hat
insofern die Möglichkeiten die er auch
gegenüber allen anderen Menschen hat die
hier in Deutschland leben oder sich
aufhalten nämlich er hat strafrechtliche
Möglichkeiten also ich hatte ja schon
gesagt dass die Schwelle für eine
strafrechtlich relevante Unterstützung
einer Terrororganisation höher liegt
also da muss mehr unterstützungshandlung
nachgewiesen werden aber wenn das
vorliegt also dieser Straftatbestand
erfüllt ist dann kann natürlich die
Bundesrepublik einfach mit den Mitteln
des Strafrechts hier reagieren
ich möchte an der Stelle aber auch
betonen dass dafür wirklich die Hürde
vergleichsweise hoch ist und das
natürlich auch zurecht weil zunächst mal
die Äußerung bestimmter politischeer
Überzeugung ja auch unter die
Meinungsfreiheit fällt und wir hier
immer eine abwegung treffen müssen
zwischen der Meinungsfreiheit auf der
einen Seite und dann eben dem Punkt an
dem deren Spielraum sozusagen
überschritten ist und wir eben wirklich
von einer Unterstützung einer einer
Terrororganisation spre
könen ja bei Menschen mit doppelter
Staatsbürgerschaft gibt es z.B auch
Forderung von verschiedenen Seiten dass
ihnen die deutsche Staatsbürgerschaft
wieder aberkannt werden soll wenn Sie
die Hamas aktiv unterstützen geht
das das geht nach gegenwärtigen recht so
nicht weil das deutsche Recht vorsieht
dass die Hürden für einen Entzug der
Staatsangehörigkeit sehr hoch
sind das hat insbesondere mit dem
Hintergrund zu tun äh der Zeit des
Nationalsozialismus in der eben sehr
stark anhand von politischen
Gesinnungen Personen die
Staatsangehörigkeit entzogen wurde also
wenn sie einfach missliebige politische
Positionen vertreten haben und um ein
solches
gesinnungsstaatsangehörigkeitsrecht zu
verhindern ist die Hürde im deutschen
Recht grundsätzlich hoch das sieht auch
das Grundgesetz vor das hierf eben hohe
Hürden vorschreibt was möglich ist ist
wenn eine Person sich aktiv an den einer
terroristischen Organisation beteiligt
dann kann sie tatsächlich auch die
Staatsangehörigkeit verlieren aber diese
Hürde ist wie ich schon formuliert habe
sehr hoch dafür muss man eben wirklich
nachweisen dass man aktiv an
Kampfhandlung beteiligt ist und nicht
einfach nur irgendeine Form von
Unterstützung auch nicht nur
finanzieller Unterstützung das würde in
dem Fall nicht
reichen jetzt haben wir viel über die
potenziellen Unterstützer der Hamas
geredet die schon hier in Deutschland
sind der Europaabgeordnete Manfred Weber
aber z.B hat auch gefordert dass an den
EU Außengrenzen konsequent geprüft
werden müsse ob ankommende Migranten in
Verbindung zur Hamas stehen was für
Herausforderungen sehen sie
da ich sehe zunächst mal praktische
Herausforderungen wie man eigentlich an
der Grenze
klar herausfinden und auch definieren
möchte dass eine Person tatsächlich die
Hamas unterstützt typischerweise kommen
ja Personen an der Grenze nicht
unbedingt mit viel Dokumenten an so dass
jetzt eher nicht zu erwarten ist dass
sie viel Beweismaterial in dieser
Hinsicht mitbringen und wenn sie eben
auch nicht in irgendeiner Datenbank als
terrorunterstützer gespeichert sind dann
kann man sich hier letztlich nur auf
Vermutung oder Indizien Stützen was
natürlich große Probleme hinsichtlich
der Rechtssicherheit aufwirft das
größere Problem sehe ich aber darin dass
sowohl der Flüchtlingsschutz als auch
also schon auf völkerrechtlicher Ebene
als auch andere Formen des
internationalen Schutzes nach
Europarecht sehr strenge Kriterien dafür
haben wann man eine Person von diesem
völkerrechtlichen oder europarechtlichen
Schutz ausschließen kann und das ist
eigentlich nur dann der Fall wenn man
wirklich selbst an terroristischen
Handlungen beteiligt war oder sehr
schwere Straftaten begangen hat oder ähm
beispielsweise an Völkermord beteiligt
war oder äh sonstige Handlung begangen
hat die eben wirklich strafrechtlich
relevant gegen die Grundsätze der
Vereinten Nationen
verstoßen und insofern ist das nicht
ganz leicht auch aus rechtlicher Sicht
wäre das schwierig umzusetzen und würde
unter Umständen mit dem internationalen
Flüchtlingsschutz und auch den
europarechtlichen Vorgaben
kollidieren zu einem anderen Vorschlag
hätten wir auch gerne noch ihre
Einschätzung und zwar Oppositionschef
März will dass jeder der in Deutschland
eingebürgert werden will ein Israel
Bekenntnis unterschreiben soll was
halten Sie
davon na ja ich frage mich dabei
zunächst ähm was das eigentlich bringen
soll natürlich haben wir auch jetzt
schon
das Bekenntnis zur freiheitlich
demokratischen Grundordnung und das
Staatsangehörigkeitsrecht verlangt auch
dass Menschen sich in die
Lebensverhältnisse in Deutschland
einordnen dazu gibt es
Einbürgerungstests die das eben auch die
da eben auch entsprechende Fragen
stellen und den man eben bestehen muss
vor der Einbürgerung und natürlich kann
man da jetzt auch noch eine Unterschrift
abverlangen dass man sagt man bekennt
sich z zum Existenzrecht des Staates
Israel aber letztlich was das in der
Praxis bringen soll also was das am
Verhalten den Überzeugung
oder den
Handlung auch von Menschen ändert da
halte ich also ich halte den
Regelungsgehalt oder den regelungserfolg
für sehr gering um umgekehrt kann man
sich aber natürlich auch fragen ob da
nicht eben auch diskriminierende
Elemente in das
Staatsangehörigkeitsrecht reinkommen wir
hatten das in der Vergangenheit mit den
einbür ersten Einbürgerungstests die
spezielle Fragen für Muslimin und für
Musliminnen und Muslime beinhaltet haben
und auch in diesem Sinne auch von den
Vereinten Nationen als rassistisch oder
rassistisch diskriminierend
identifiziert wurden und da kann man
sich natürlich schon fragen wenn man
jetzt nur bestimmte Leute von bestimmten
Leuten bestimmte gesinnungs
[Musik]
gesinnungsbekenntnisse abverlangt ob das
nicht dann letztlich auch irgendwie eine
diskriminierende Form ist aber das wäre
eben ist eine Frage der Ausgestaltung
man könnte ein solches Bekenntnis
rechtskonform sicherlich ausgestalten im
Staatsangehörigkeitsrecht
und hinter dem Ziel stehen sicherlich
auch sehr viele aber die Frage was was
das tatsächlich bringt für die Regelung
des Staatsangehörigkeitsrechts und für
die tatsächliche Überzeugung der
Menschen die eingebürgert werden das da
halt ich bin ich bin ich sehr skeptisch
ob das überhaupt was bringt ich halte
das eigentlich mehr für
Symbolpolitik ja auch viel diskutiert
wird ja im Moment in Deutschland wie man
mit proalästinensischen Demonstrationen
umgehen sollte wenn der Verdacht besteht
dass sie antisemitischenem Hass eine
Plattform
bieten wie ist das rechtlich
einzuordnen na ja zunächst greift hier
das Versammlungsrecht das heißt äh
Versammlungen bei denen äh ernsthaft zu
erwarten ist dass hier ähm
antisemitische Propaganda und Hetze äh
vielleicht sogar auch Gewaltaufrufe
stattfinden können nach dem
Versammlungsrecht verboten werden ähm
das gleiche gilt auch bei
Veranstaltungen die zunächst mal
zulässig und legal sind wo dann aber wer
während der Veranstaltung ist zu
entsprechenden sage ich mal
Ausschreitungen oder auch verbalen
Entgleisungen im größeren Umfang kommt
auch da kann die Veranstaltung dann auch
noch verboten und aufgelöst werden das
heißt hier bietet eigentlich das
Versammlungsrecht relativ viele
Möglichkeiten die zum Teil ja auch schon
in der Praxis angewandt wurden man muss
natürlich im Versammlungsrecht weil das
natürlich ein wichtiges demokratisches
Grundrecht ist auch immer aufpassen ab
welchem Zeitpunkt man wirklich eine
anstaltung verbietet oder
eben bis wohin man sie auch zulassen
muss aus demokratischen Gründen weil wir
eben auch ein gewisses Meinungsspektrum
eben aushalten müssen aber das endet
natürlich klarerweise dort wo
antisemitische Hasspropaganda betrieben
wird und wo eben auch die Veranstalter
nicht kontrollieren können oder nicht im
Griff haben dass das eben nicht im
großen Stil auf der Veranstaltung auch
passiert
hfahrer hat vielen Dank für diese
Einsichten und für das
Gespräch vielen",20231025
kbcTN7uGVO4,Israel: Vorbereitungen auf Einsatz im Gazastreifen laufen weiter | DW Nachrichten,data/de_DW\Israel Vorbereitungen auf Einsatz im Gazastreifen laufen weiter  DW Nachrichten.jpg,"Israel wird den Beginn seiner geplanten
Bodenoffensive im Gazastreifen offenbar
noch aufschieben das zumindest berichtet
das Wall Street Journal unter Berufung
auf israelische und US-amerikanische
Regierungskreise demnach hätten die USA
darum gebeten zunächst eigene
Luftabwehrsysteme in der Region zu
stationieren bis das erfolgt ist könnten
einige Tage vergehen die Vorbereitungen
auf den schwierigen Einsatz laufen
weiter auf hocht
Übungen für die nächste Phase des
Kampfes unter diesem Titel
veröffentlicht die israelische Armee
dieses Video Soldaten zweier Bataillone
bereiten sich auf eine Bodenoffensive im
Gazastreifen vor die Operation gilt
unter Militärexperten als extrem
schwierig und gefährlich um eine
friedliche Lösung für die Geiseln der
Hamas zu erreichen laufen die
diplomatischen Bemühungen unter
Hochdruck Frankreichs Präsident macron
führte nach seinem Besuch in Israel am
Vortag Gespräche mit Palästinenser
Präsident Abbas sowie mit den
Staatsoberhäuptern in Jordanien und
Ägypten was die Freilassung der Geiseln
angeht kommen optimistische Töne aus
Qatar das mit seinen Kontakten zur
Terrororganisation Hamas als Vermittler
agiert ich denke wenn wir vergleichen wo
wir gestartet sind und wo wir heute
stehen dann ist einiges an Fortschritt
zu sehen auch
Erfolge wir bleiben zuversichtlich die
Verhandlungen gehen weiter ich denke
dass wir jederzeit in der Lage sein
werden den beiden Parteien zu vermitteln
und dass wir hoffentlich bald einige
Durchbrüche erleben
werden im Norden Israels an der Grenze
zum Libanon waren die Behörden weiter
vor Angriffen der militant schiitischen
hisbolla viele der Bewohner haben Angst
sitzen auf gepackten
Koff ein SE h auf der anderenboll das
ist nicht leicht für die Leute hier von
einem Tag auf den anderen ihre Häuser
verlassen von ihren Familien WE aufgeben
das ist nicht
leicht das israelische Militär hat auch
hier bodenuppen positioniert um für den
Fall einer Eskalation im Norden gerüstet
zu sein sein Schwerpunkt liegt jedoch
auf dem Kampf gegen die Hamas im
Gazastreifen ein Armeesprecher wendet
sich an die dortige
Bevölkerung wir richten uns an alle
Bewohner von gazastadt und seiner
Umgebung die Terrororganisation Hamas
benutzt euch sie nutzen eure Häuser
Schulen Krankenhäuser sie unterhöhlen
den Boden unter euren Häusern in der
Nähe von Krankenhäusern und
Schulen sie verstecken sich doch lasst
euch nicht als Schutzschild missbrauchen
geht nach Süden südlich von Wadi
Gaza aber auch der Süden des
Gazastreifens ist nicht sicher vor
israelischen Militärschlägen denn auch
von dort hat es Beschuss durch die Hamas
gegeben es wurden am Mittwoch mehrere
Ziele von israelischen Raketen getroffen
mehrere Menschen sollen ums Leben
gekommen
sein Guido Steinberg ist mit uns
verbunden er ist na Ost und
terrorismusexperte bei der Stiftung
Wissenschaft und Politik ich grüße
sie guten Abend sprechen wir zunächst
über die Verhandlung zur Freilassung der
Geiseln wie zentral ist hier die Rolle
von
Qatar es gibt keinen anderen Akteur als
Qatar der überhaupt für diese
Vermittlung in Frage kommt und das hat
vor allem damit zu tun dass Qatar sehr
gute Beziehungen zu den USA unterhält
die USA sind die Schutzmacht des Landes
gleichzeitig unterhält Qatar sehr sehr
gute Beziehungen zuur Hamas Qatar ist
der wichtigste financier zumindest der
Regierung im Gazastreifen wenn nicht der
der Hamas insgesamt die teriz sagt sie
würde weitere Geiseln freilassen wenn
Israel Feuerpausen einwilligt Israel
zögert aber welche strategischen Gründe
könnte das
haben nun äh die israelische Regierung
hat es ja mit einem Zielkonflikt zu tun
sie möchten einerseits sehr sehr
entschieden äh auf die hamasangriffe vom
7 Oktober reagieren und das mit einer
Bodenoffensive gleichzeitig hat die
israelische Regierung ein überragendes
Interesse daran möglichst viele Geiseln
vor einer solchen Bodenoffensive
freiubekommen jetzt hat die die Hamas
einige Geiseln freigelassen und
das sorgt natürlich auf der israelischen
Seite für Diskussionen äh anscheinend
weiß die Regierung dort nicht so ganz
genau welche Priorität sie jetzt setzen
soll ähm und das ist wohl der Grund
dafür warum wir jetzt schon eine ganze
Weile auf diese Bodenoffensive warten
die ja mehrfach bereits angekündigt
wurde wie schätzen Sie das ein diesen
Medienbericht dass sich die
Bodenoffensive verzögern könnte weil die
USA noch Abwehrsysteme
liefern ja das ist auch eine Möglichkeit
insgesamt ist es so dass die israelische
Seite dieses Problem noch nicht
ausdiskutiert hat und dass auch noch
nicht alle Vorbereitungen getroffen sind
ich halte allerdings solche ja eher
technischen Fragen wie die Lieferung von
Abwehrsystemen
für für eher zweitrangig ich glaube es
geht immer noch um die politischen
Fragen der Präsident beiden hat ja
schon vor einer Woche angemahnt dass
Israel doch bitte eine politische
Strategie entwickeln soll
bevor die Regierung Truppen in den
Gazastreifen schickt ich denke das sind
die die wichtigeren die übergreifenden
Gründe plus das Schicksal der Geiseln
die jetzt dafür sorgen dass die Israelis
sich mit den mit mit der Bodenoffensive
doch etwas mehr Zeit lassen Herr
Steinberg wir sprechen gleich noch
weiter zunächst aber wollen wir einen
genaueren Blick auf die Lage im
Gazastreifen werfen und auf die
Äußerungen von un- Generalsekretär
Antonio gterisch im Sicherheitsrat vom
Dienstag dar hatte er den Angriff der
terroristischen Hamas auf Israel zwar
klar verurteilt aber auch Israel im
Umgang mit den Palästinensern eine
Verletzung des Völkerrechts vorgeworfen
was hohe Wellen schlug der israelische
Botschafter bei den Vereinten Nationen
Gilad erdan etwa forderte den Rücktritt
des unchefs unterdessen bleibt die Lage
für die Menschen im Gazastreifen
dramatisch Trauer in hananjunis unter
den Toten und Verletzten der jüngsten
israelischen Luftschläge sind viele
Kinder
mehr als 340 seinen innerhalb eines
Tages getötet worden so der
Gesundheitsdienst im gaserstreifen der
der militant islamistischen Hamas
unterstellt ist auch in rafach weiter
südlich klagen
sie unter diesen Trümmern liegen nicht
weniger als 20 Kinder nur Kinder und
Zivilisten keine
Kämpfer ist das einer von denen die
entführt oder getötet haben
nach Angaben des Kinderhilfswerks
uniceef starben seit dem terroristischen
Überfall der hamass auf Israel durch
israelische Gegenschläge
2360 Kinder im
gaserstreifen tausende Jungen und
Mädchen sind verletzt und die
medizinische Versorgung wird immer
schwieriger die Situation in den
Krankenhäusern ist dramatisch auch wenn
mittlerweile ein vierter Konvoi mit
Arzneimitteln Säuglingsmilch und trink
Wasser aus Ägypten im gaserstreifen
angekommen ist
dennoch fast noch wichtiger als alles
andere ist der
Treibstoff bislang wurde kein Treibstoff
in den gaserstreifen
gelassen aber ohne Treibstoff können die
Lastwagen nicht fahren ohne Treibstoff
können die Generatoren keinen Strom für
die Krankenhäuser die Bäckereien und die
wasserentsalzungsanlagen erzeugt
trotz der Hilfslieferung berichtet ein
Arzt in hanunes von Operationen ohne
Betäubung mehrere Kliniken in dem
abgeriegelten Küstenstreifen sollen
bereits geschlossen worden sein aufgrund
des
Mangels in gaserstadt gelingt es Rettern
dieses Mädchen aus den Trümmern eines
Hauses zu ziehen sie braucht jetzt
dringend medizinische
Versorgung der N Ost und
terrorismusexperte Gido Steinberg von
der Stiftung Wissenschaft und Politik
ist immer noch mit uns verbunden wie
kann Israel dieses Dilemma lösen
einerseits gegen die Terroristen von
deramass vorzugehen und dabei dennoch
das Leid der unbeteiligten im
Gazastreifen nicht außer Acht zu
lassen nun israel hat das an ein paar
Stellen bereits versucht
der wichtigste Schritt war dass die
Bevölkerung des nördlichen Gazastreifens
aufgefordert wurde das Gebiet in
Richtung Süden zu verlassen wir haben
nur erlebt dass große Teile der
Bevölkerung das aus unterschiedlichen
Gründen nicht können entweder weil es
ihnen an Geld fehlt oder weil sie Angst
haben dann nicht mehr zurückkehren zu
können oder weil die Hamas ihre ihre
Reise in den in den Süden verhindert das
wäre aus meiner Sicht der wichtigste
Schritt gewesen
ähm solange aber Zivilisten im Norden
des Gazastreifens Leben äh müssen die
Israelis bei allen ihren Angriffen damit
rechnen dass es äh Kollateralschäden
unter der Zivilbevölkerung gibt ähm und
diese diese mittlerweile ja auch sehr
vielen Toten dafür sorgen dass der
internationale Widerstand gegen ihre
Offensive auch noch wächst äh aus dem
Dilemma kommt Israel also nicht
heraus wir haben Gehör dass Treibstoff
dringend gebraucht wird darum wird
gestritten ob der geliefert werden kann
wie gefährlich sind solche Lieferung
wenn dieser treibstad tatsächlich
Treibstoff tatsächlich in die Hände der
Hamas kommt was Israel offenbar
befürchtet ja das ist äh das ist auch
durchaus realistisch es hat ja äh in
letzter Zeit äh schon einige Berichte
darüber gegeben dass die Hamas auch
private Treibstofftanks abzapft um auf
diese Weise neuen Treibstoff für die
eigenen Einheiten zu gewinnen ähm auch
für die für die gesamte Infrastruktur
der Hamas benötigt man eine Menge
Treibstoff alleine um die gener
Generatoren zu betreiben die israelische
Befürchtung ist also nicht von der Hand
zu weisen insgesamt ist es so dass jede
Lieferung in den gaserstreifen sei es
nun Wasser sein eines Lebensmittel sei
es Treibstoff natürlich auch von der
Hamas genutzt werden wird die
Organisation hat dort fast die
uneingeschränkte Kontrolle da ist also
Israel wieder vor allem Dilemma liefern
sie Treibstoff nützt das der Hamas
liefern sie keinen Treibstoff nützt das
der Propaganda der Hamers sag der
Experte von der Stiftung Wissenschaft
und Politik Berg vielen Dank
dafür",20231025
